{
  "schemaVersion": "0.1.0",
  "kind": "dialogue",
  "id": "io.github.theboyyss.missingdialoguevoiceassets.dialogue",
  "lines": [
    {
      "id": "io.github.theboyyss.missingdialoguevoiceassets.dialogue.intro.hello",
      "questId": "io.github.theboyyss.missingdialoguevoiceassets.quest.intro",
      "topicId": "io.github.theboyyss.missingdialoguevoiceassets.topic.greeting",
      "responseText": "Synthetic line with missing voice assets.",
      "voice": {
        "plugin": "MissingDialogueVoiceAssets.esm",
        "voiceType": "ExampleVoice",
        "fileStem": "intro_hello"
      }
    }
  ]
}
